SQL*Plus: Release 21.0.0.0.0 - Production on Wed Sep 17 10:12:15 2025
Version 21.3.0.0.0

Copyright (c) 1982, 2021, Oracle.  All rights reserved.

Enter user-name: system
Enter password:
Last Successful login time: Wed Sep 17 2025 09:55:44 +05:30

Connected to:
Oracle Database 21c Express Edition Release 21.0.0.0.0 - Production
Version 21.3.0.0.0

SQL> CREATE TABLE clientmaster (
  2     srno INT,
  3     name VARCHAR2(20)
  4  );

Table created.

SQL> CREATE TABLE audi (
  2     srno INT,
  3     name VARCHAR2(50)
  4  );

Table created.

SQL> CREATE TABLE insertbackup AS SELECT * FROM clientmaster;

Table created.

SQL> INSERT INTO clientmaster VALUES (201, 'Sarthak');

1 row created.

SQL> INSERT INTO clientmaster VALUES (202, 'Atharva');

1 row created.

SQL> COMMIT;

Commit complete.

SQL> @C:\Users\sarth\OneDrive\Desktop\backup_trigger.sql

Trigger created.

SQL> UPDATE clientmaster SET name = 'Om' WHERE srno = 201;

1 row updated.

SQL> DELETE FROM clientmaster WHERE srno = 202;

1 row deleted.

SQL> SELECT * FROM audi;

      SRNO NAME
---------- --------------------
       201 Sarthak (BACKUP)
       202 Atharva (BACKUP)

SQL> @C:\Users\sarth\OneDrive\Desktop\insert_trigger.sql

Trigger created.

SQL> INSERT INTO clientmaster VALUES (203, 'Rohit');

1 row created.

SQL> SELECT * FROM insertbackup;

      SRNO NAME
---------- --------------------
       203 Rohit (INSERTED)

SQL> @C:\Users\sarth\OneDrive\Desktop\audit_insert.sql

Trigger created.

SQL> INSERT INTO audi VALUES (204, 'CheckTrigger');
INSERT INTO audi VALUES (204, 'CheckTrigger')
            *
ERROR at line 1:
ORA-20001: Cannot delete or insert in September
ORA-06512: at "SYSTEM.INSERT_AUDIT_D", line 3
ORA-04088: error during execution of trigger 'SYSTEM.INSERT_AUDIT_D'

SQL> @C:\Users\sarth\OneDrive\Desktop\audit_update.sql

Trigger created.

SQL> UPDATE audi SET name = 'Suhas' WHERE srno = 204;
UPDATE audi SET name = 'Suhas' WHERE srno = 204
       *
ERROR at line 1:
ORA-20002: Cannot update or delete in September
ORA-06512: at "SYSTEM.UPDATE_DELETE_AUDIT_D", line 3
ORA-04088: error during execution of trigger 'SYSTEM.UPDATE_DELETE_AUDIT_D'

SQL> SELECT * FROM clientmaster;

      SRNO NAME
---------- --------------------
       201 Om
       203 Rohit

SQL> SELECT * FROM audi;

      SRNO NAME
---------- --------------------
       201 Sarthak (BACKUP)
       202 Atharva (BACKUP)
